{
  "schema_version": 1,
  "run_metadata": {
    "run_id": "P22-EVAL-05",
    "timestamp": "2026-09-16T15:02:42.583301+00:00",
    "product_version": "0.1.0",
    "git_head": "ec55a033e7f51d9869a889c19d95c913c475ba53",
    "git_head_source": "detected from repository",
    "worktree_state_id": "sha256-manifest-v1:93967e3fe53ed0dfb43c64fbf3d2ed815a711c3c932ae4743470e923621b25ad",
    "eval_corpus_version": "p22-product-acceptance-v1",
    "platform": "macOS-26.6.2-arm64-arm-64bit",
    "python_version": "3.12.13",
    "provider": "N/A",
    "model": "N/A",
    "database_fixture_or_state_snapshot": "unavailable — quantitative aggregation only; no live database fixture was executed"
  },
  "corpus": {
    "path": "eval/product_acceptance_v1.yaml",
    "schema_version": 1,
    "version": "p22-product-acceptance-v1",
    "task_count": 15
  },
  "cases": [
    {
      "eval_case_id": "ACPT-REC-001",
      "parent_task_id": null,
      "name": "Scene-based Recommendation",
      "type": "Core",
      "priority": "P0",
      "scope": "task",
      "counts_toward_acceptance_metrics": true,
      "result": "NOT_RUN",
      "automated_result": "NOT_RUN",
      "owner_uat_result": "NOT_RUN",
      "owner_uat_required_for_case": false,
      "failure_layer": null,
      "root_cause_status": null,
      "wrong_action": null,
      "action_executed": false,
      "evidence": [],
      "notes": [
        "Not executed in this run; absence is not treated as failure."
      ]
    },
    {
      "eval_case_id": "ACPT-REC-002",
      "parent_task_id": null,
      "name": "Mood-based Recommendation",
      "type": "Core",
      "priority": "P0",
      "scope": "task",
      "counts_toward_acceptance_metrics": true,
      "result": "NOT_RUN",
      "automated_result": "NOT_RUN",
      "owner_uat_result": "NOT_RUN",
      "owner_uat_required_for_case": false,
      "failure_layer": null,
      "root_cause_status": null,
      "wrong_action": null,
      "action_executed": false,
      "evidence": [],
      "notes": [
        "Not executed in this run; absence is not treated as failure."
      ]
    },
    {
      "eval_case_id": "ACPT-REC-003",
      "parent_task_id": null,
      "name": "Similarity",
      "type": "Core",
      "priority": "P0",
      "scope": "task",
      "counts_toward_acceptance_metrics": true,
      "result": "NOT_RUN",
      "automated_result": "NOT_RUN",
      "owner_uat_result": "NOT_RUN",
      "owner_uat_required_for_case": false,
      "failure_layer": null,
      "root_cause_status": null,
      "wrong_action": null,
      "action_executed": false,
      "evidence": [],
      "notes": [
        "Not executed in this run; absence is not treated as failure."
      ]
    },
    {
      "eval_case_id": "ACPT-DIS-001",
      "parent_task_id": null,
      "name": "Discovery",
      "type": "Core",
      "priority": "P0",
      "scope": "task",
      "counts_toward_acceptance_metrics": true,
      "result": "NOT_RUN",
      "automated_result": "NOT_RUN",
      "owner_uat_result": "NOT_RUN",
      "owner_uat_required_for_case": false,
      "failure_layer": null,
      "root_cause_status": null,
      "wrong_action": null,
      "action_executed": false,
      "evidence": [],
      "notes": [
        "Not executed in this run; absence is not treated as failure."
      ]
    },
    {
      "eval_case_id": "ACPT-CTX-001",
      "parent_task_id": null,
      "name": "Current Intent vs Long-term Preference",
      "type": "Core",
      "priority": "P0",
      "scope": "task",
      "counts_toward_acceptance_metrics": true,
      "result": "NOT_RUN",
      "automated_result": "NOT_RUN",
      "owner_uat_result": "NOT_RUN",
      "owner_uat_required_for_case": false,
      "failure_layer": null,
      "root_cause_status": null,
      "wrong_action": null,
      "action_executed": false,
      "evidence": [],
      "notes": [
        "Not executed in this run; absence is not treated as failure."
      ]
    },
    {
      "eval_case_id": "ACPT-CTX-002",
      "parent_task_id": null,
      "name": "Continuous Adjustment",
      "type": "Core",
      "priority": "P0",
      "scope": "task",
      "counts_toward_acceptance_metrics": true,
      "result": "NOT_RUN",
      "automated_result": "NOT_RUN",
      "owner_uat_result": "NOT_RUN",
      "owner_uat_required_for_case": false,
      "failure_layer": null,
      "root_cause_status": null,
      "wrong_action": null,
      "action_executed": false,
      "evidence": [],
      "notes": [
        "Not executed in this run; absence is not treated as failure."
      ]
    },
    {
      "eval_case_id": "ACPT-CTX-003",
      "parent_task_id": null,
      "name": "Ambiguous Context",
      "type": "Core",
      "priority": "P0",
      "scope": "task",
      "counts_toward_acceptance_metrics": true,
      "result": "NOT_RUN",
      "automated_result": "NOT_RUN",
      "owner_uat_result": "NOT_RUN",
      "owner_uat_required_for_case": false,
      "failure_layer": null,
      "root_cause_status": null,
      "wrong_action": null,
      "action_executed": false,
      "evidence": [],
      "notes": [
        "Not executed in this run; absence is not treated as failure."
      ]
    },
    {
      "eval_case_id": "ACPT-FAIL-001",
      "parent_task_id": null,
      "name": "No Candidate",
      "type": "Core",
      "priority": "P0",
      "scope": "task",
      "counts_toward_acceptance_metrics": true,
      "result": "NOT_RUN",
      "automated_result": "NOT_RUN",
      "owner_uat_result": "NOT_RUN",
      "owner_uat_required_for_case": false,
      "failure_layer": null,
      "root_cause_status": null,
      "wrong_action": null,
      "action_executed": false,
      "evidence": [],
      "notes": [
        "Not executed in this run; absence is not treated as failure."
      ]
    },
    {
      "eval_case_id": "ACPT-PRE-001",
      "parent_task_id": null,
      "name": "Preview Unavailable",
      "type": "Core",
      "priority": "P0",
      "scope": "task",
      "counts_toward_acceptance_metrics": true,
      "result": "NOT_RUN",
      "automated_result": "NOT_RUN",
      "owner_uat_result": "NOT_RUN",
      "owner_uat_required_for_case": false,
      "failure_layer": null,
      "root_cause_status": null,
      "wrong_action": null,
      "action_executed": false,
      "evidence": [],
      "notes": [
        "Not executed in this run; absence is not treated as failure."
      ]
    },
    {
      "eval_case_id": "ACPT-PLAY-001",
      "parent_task_id": null,
      "name": "Playback Permission Failure",
      "type": "Core",
      "priority": "P0",
      "scope": "task",
      "counts_toward_acceptance_metrics": true,
      "result": "NOT_RUN",
      "automated_result": "NOT_RUN",
      "owner_uat_result": "NOT_RUN",
      "owner_uat_required_for_case": false,
      "failure_layer": null,
      "root_cause_status": null,
      "wrong_action": null,
      "action_executed": false,
      "evidence": [],
      "notes": [
        "Not executed in this run; absence is not treated as failure."
      ]
    },
    {
      "eval_case_id": "ACPT-FAIL-002",
      "parent_task_id": null,
      "name": "Tool / External Service Failure",
      "type": "Core",
      "priority": "P0",
      "scope": "task",
      "counts_toward_acceptance_metrics": true,
      "result": "NOT_RUN",
      "automated_result": "NOT_RUN",
      "owner_uat_result": "NOT_RUN",
      "owner_uat_required_for_case": false,
      "failure_layer": null,
      "root_cause_status": null,
      "wrong_action": null,
      "action_executed": false,
      "evidence": [],
      "notes": [
        "Not executed in this run; absence is not treated as failure."
      ]
    },
    {
      "eval_case_id": "ACPT-COLD-001",
      "parent_task_id": null,
      "name": "Cold Start / No Preference Data",
      "type": "Core",
      "priority": "P1",
      "scope": "task",
      "counts_toward_acceptance_metrics": true,
      "result": "NOT_RUN",
      "automated_result": "NOT_RUN",
      "owner_uat_result": "NOT_RUN",
      "owner_uat_required_for_case": false,
      "failure_layer": null,
      "root_cause_status": null,
      "wrong_action": null,
      "action_executed": false,
      "evidence": [],
      "notes": [
        "Not executed in this run; absence is not treated as failure."
      ]
    },
    {
      "eval_case_id": "ACPT-FB-001",
      "parent_task_id": null,
      "name": "Feedback Semantics",
      "type": "Core",
      "priority": "P0",
      "scope": "task",
      "counts_toward_acceptance_metrics": true,
      "result": "NOT_RUN",
      "automated_result": "NOT_RUN",
      "owner_uat_result": "NOT_RUN",
      "owner_uat_required_for_case": false,
      "failure_layer": null,
      "root_cause_status": null,
      "wrong_action": null,
      "action_executed": false,
      "evidence": [],
      "notes": [
        "Not executed in this run; absence is not treated as failure."
      ]
    },
    {
      "eval_case_id": "ACPT-P22-ROUTE-001",
      "parent_task_id": null,
      "name": "Deterministic Playback Command",
      "type": "Extension",
      "priority": "P0",
      "scope": "task",
      "counts_toward_acceptance_metrics": true,
      "result": "PASS",
      "automated_result": "PASS",
      "owner_uat_result": "PASS",
      "owner_uat_required_for_case": true,
      "failure_layer": null,
      "root_cause_status": "resolved_and_verified",
      "wrong_action": false,
      "action_executed": true,
      "evidence": [
        {
          "kind": "historical_regression",
          "reference": "eval/runs/P22-S1.12-ROUTE-REGRESSION.md",
          "notes": "Controlled route regression artifact; current project state separately records P22-S1.12 as VERIFIED."
        },
        {
          "kind": "owner_current_state",
          "reference": "P22-S1.12 VERIFIED",
          "notes": "Owner-supplied current project baseline."
        }
      ],
      "notes": [